{"answered":1,"backend":"jev","cases":3,"error_rate":0.6666666666666666,"errors":[{"error":"HTTP 500 from provider","id":"t02"},{"error":"answers['refund']: probability 4.0 is outside [0, 1]","id":"t03"}],"jevdecision_version":"0.2.0","model":"jev-example","produced_by":{"name":"jevdecision","version":"0.2.0"},"questions":{"department":{"accuracy":1.0,"accuracy_lower":0.2065493143772375,"accuracy_upper":1.0,"brier":0.03500000000000001,"confusion":{"technical":{"technical":1}},"ece":0.15000000000000002,"log_loss":0.16251892949777494,"n":1,"refusal_rate":0.0,"refusals":0,"type":"choice"},"frustration":{"accuracy":1.0,"accuracy_lower":0.2065493143772375,"accuracy_upper":1.0,"brier":0.03500000000000001,"ece":0.15000000000000002,"log_loss":0.16251892949777494,"mae":0.050000000000000044,"n":1,"refusal_rate":0.0,"refusals":0,"type":"score","within_one":1.0},"refund":{"accuracy":1.0,"accuracy_lower":0.2065493143772375,"accuracy_upper":1.0,"base_rate":0.0,"brier":0.0064,"ece":0.08,"log_loss":0.08338160893905101,"mean_probability":0.08,"n":1,"refusal_rate":0.0,"refusals":0,"type":"noul"}},"requirements":[{"bound":"max","check":"error_rate","limit":0.0,"pass":false,"value":0.6666666666666666}],"schema_version":2,"source":"live","status":"FAIL"}