{"answered":12,"backend":"jev","cases":12,"error_rate":0.0,"errors":[],"jevdecision_version":"0.2.0","model":"jev-example","produced_by":{"name":"jevdecision","version":"0.2.0"},"questions":{"department":{"accuracy":0.9166666666666666,"accuracy_lower":0.6461200888588832,"accuracy_upper":0.9851349055950829,"brier":0.11981666666666668,"confusion":{"billing":{"billing":5},"sales":{"billing":1,"sales":2},"technical":{"technical":4}},"ece":0.11583333333333334,"log_loss":0.24557685817761374,"n":12,"refusal_rate":0.0,"refusals":0,"type":"choice"},"frustration":{"accuracy":1.0,"accuracy_lower":0.7575059933447593,"accuracy_upper":1.0,"brier":0.12608333333333335,"ece":0.2275,"log_loss":0.27424616685455433,"mae":0.18416666666666667,"n":12,"refusal_rate":0.0,"refusals":0,"type":"score","within_one":1.0},"refund":{"accuracy":0.9166666666666666,"accuracy_lower":0.6461200888588832,"accuracy_upper":0.9851349055950829,"base_rate":0.4166666666666667,"brier":0.03464166666666667,"ece":0.1075,"log_loss":0.13633790605038312,"mean_probability":0.3758333333333333,"n":12,"refusal_rate":0.0,"refusals":0,"type":"noul"}},"requirements":[{"bound":"max","check":"error_rate","limit":0.0,"pass":true,"value":0.0},{"bound":"min","check":"refund.n","limit":10,"pass":true,"value":12},{"bound":"min","check":"refund.accuracy","limit":0.85,"pass":true,"value":0.9166666666666666},{"bound":"max","check":"refund.brier","limit":0.1,"pass":true,"value":0.03464166666666667},{"bound":"min","check":"department.n","limit":10,"pass":true,"value":12},{"bound":"min","check":"department.accuracy","limit":0.8,"pass":true,"value":0.9166666666666666},{"bound":"max","check":"department.log_loss","limit":0.5,"pass":true,"value":0.24557685817761374},{"bound":"min","check":"frustration.n","limit":10,"pass":true,"value":12},{"bound":"min","check":"frustration.within_one","limit":0.95,"pass":true,"value":1.0},{"bound":"max","check":"frustration.mae","limit":0.5,"pass":true,"value":0.18416666666666667}],"schema_version":2,"source":"replay","status":"FAIL"}